{
  "id": "1a2b3c4d-5e6f-4a7b-8c9d-0e1f2a3b4c5d",
  "email": "sophie.laurent@example.fr",
  "user_id": "a1b2c3d4-e5f6-4a7b-8c9d-0e1f2a3b4c5d",
  "workshop_family": "FDFP",
  "city": "Marseille",
  "radius_km": 50,
  "status": "waiting",
  "geographic_hint": "Préférence pour les quartiers sud, accessible en transport en commun",
  "notified_at": null,
  "notified_workshop_id": null,
  "tenant_id": "1er-Degré",
  "created_at": "2025-09-15T11:30:00Z",
  "updated_at": "2025-09-15T11:30:00Z"
}
