{
  "id": "6f7e8d9c-0b1a-4253-6d8e-7f6a5b4c3d2e",
  "email": "thomas.bernard@example.com",
  "user_id": null,
  "workshop_family": "HD",
  "city": "Toulouse",
  "radius_km": 35,
  "status": "converted",
  "geographic_hint": null,
  "notified_at": "2025-10-02T08:45:00Z",
  "notified_workshop_id": "8a9b0c1d-2e3f-4a5b-6c7d-8e9f0a1b2c3d",
  "tenant_id": "1er-Degr√©",
  "created_at": "2025-09-20T14:12:00Z",
  "updated_at": "2025-10-03T10:22:00Z"
}
